{"eventId":"event-alpha-dispatch","eventType":"dispatch","evidenceDigest":"sha256:9999999999999999999999999999999999999999999999999999999999999999","occurredAt":"2026-09-01T12:00:30Z","payloadDigest":"sha256:aaaaaaaaaaaaaaaaaaaaaaaaaaaaaaaaaaaaaaaaaaaaaaaaaaaaaaaaaaaaaaaa","previousEventDigest":null,"runId":"cb-rolling-1111111111111111","schemaVersion":"compass-builder.pipeline-event.v2","sequence":1,"stateAfter":"running","stateBefore":"never-launched","storyId":"alpha"}
